{
  "schemaVersion": "1.0.0",
  "frameworkId": "ncom",
  "commit": "a350b576bbeae6c6254273037a17d2a8730fb80f",
  "generatedAt": "2026-07-30T08:03:42.486Z",
  "conflicts": [
    {
      "id": "conflict-79746bc3a8d9894c",
      "component": "NCCard",
      "itemKind": "attribute",
      "itemName": "shadow",
      "sourceA": "official-doc",
      "sourceB": "type-definition",
      "evidence": [
        {
          "sourceId": "ncom-repository-docs",
          "sourceType": "official-doc",
          "path": ".framework-sources/ncom-a350b57/doc/api/components/card.md",
          "url": null,
          "lineStart": 19,
          "lineEnd": 19,
          "sha256": "sha256:b6f9d4c259290a5a98e96f110029a9e48621e83241e0f9ab049f7c2b729b0ce4",
          "commit": "a350b576bbeae6c6254273037a17d2a8730fb80f"
        },
        {
          "sourceId": "symbol:symbol-369ca190b7de7991",
          "sourceType": "type-definition",
          "path": "packages/components/src/card/types.ts",
          "url": null,
          "lineStart": 8,
          "lineEnd": 8,
          "sha256": "sha256:563f74dbdfe0e617a21aa8a607c8a9a4ec24e919a321990cd571db7dcb830892",
          "commit": "a350b576bbeae6c6254273037a17d2a8730fb80f"
        }
      ],
      "severity": "error",
      "suggestedAction": "人工核对所列证据；本报告不自动选择冲突值。",
      "conflictType": "type-mismatch"
    },
    {
      "id": "conflict-926b32b21ace4a51",
      "component": "NCCard",
      "itemKind": "attribute",
      "itemName": "width",
      "sourceA": "type-definition",
      "sourceB": "official-doc",
      "evidence": [
        {
          "sourceId": "symbol:symbol-b89cc6173317d04b",
          "sourceType": "type-definition",
          "path": "packages/components/src/card/types.ts",
          "url": null,
          "lineStart": 10,
          "lineEnd": 10,
          "sha256": "sha256:563f74dbdfe0e617a21aa8a607c8a9a4ec24e919a321990cd571db7dcb830892",
          "commit": "a350b576bbeae6c6254273037a17d2a8730fb80f"
        },
        {
          "sourceId": "ncom-repository-docs",
          "sourceType": "official-doc",
          "path": ".framework-sources/ncom-a350b57/doc/api/components/card.md",
          "url": null,
          "lineStart": null,
          "lineEnd": null,
          "sha256": "sha256:b6f9d4c259290a5a98e96f110029a9e48621e83241e0f9ab049f7c2b729b0ce4",
          "commit": "a350b576bbeae6c6254273037a17d2a8730fb80f"
        }
      ],
      "severity": "warning",
      "suggestedAction": "人工确认该公开项是否应补充到官方文档。",
      "conflictType": "source-public-item-not-documented"
    },
    {
      "id": "conflict-85a05152e99bf58e",
      "component": "NCCard",
      "itemKind": "attribute",
      "itemName": "height",
      "sourceA": "type-definition",
      "sourceB": "official-doc",
      "evidence": [
        {
          "sourceId": "symbol:symbol-0161d76a10cafbe1",
          "sourceType": "type-definition",
          "path": "packages/components/src/card/types.ts",
          "url": null,
          "lineStart": 11,
          "lineEnd": 11,
          "sha256": "sha256:563f74dbdfe0e617a21aa8a607c8a9a4ec24e919a321990cd571db7dcb830892",
          "commit": "a350b576bbeae6c6254273037a17d2a8730fb80f"
        },
        {
          "sourceId": "ncom-repository-docs",
          "sourceType": "official-doc",
          "path": ".framework-sources/ncom-a350b57/doc/api/components/card.md",
          "url": null,
          "lineStart": null,
          "lineEnd": null,
          "sha256": "sha256:b6f9d4c259290a5a98e96f110029a9e48621e83241e0f9ab049f7c2b729b0ce4",
          "commit": "a350b576bbeae6c6254273037a17d2a8730fb80f"
        }
      ],
      "severity": "warning",
      "suggestedAction": "人工确认该公开项是否应补充到官方文档。",
      "conflictType": "source-public-item-not-documented"
    },
    {
      "id": "conflict-e8c22ad68417f5c8",
      "component": "NCCard",
      "itemKind": "slot",
      "itemName": "default",
      "sourceA": "source-code",
      "sourceB": "official-doc",
      "evidence": [
        {
          "sourceId": "symbol:NCCard",
          "sourceType": "source-code",
          "path": "packages/components/src/card/index.ts",
          "url": null,
          "lineStart": 25,
          "lineEnd": 25,
          "sha256": "sha256:37cd9d9ede0cc520809dc0c85fe76ba5c3e63e8d53a1cd9cbc1de4c56005dd69",
          "commit": "a350b576bbeae6c6254273037a17d2a8730fb80f"
        },
        {
          "sourceId": "ncom-repository-docs",
          "sourceType": "official-doc",
          "path": ".framework-sources/ncom-a350b57/doc/api/components/card.md",
          "url": null,
          "lineStart": null,
          "lineEnd": null,
          "sha256": "sha256:b6f9d4c259290a5a98e96f110029a9e48621e83241e0f9ab049f7c2b729b0ce4",
          "commit": "a350b576bbeae6c6254273037a17d2a8730fb80f"
        }
      ],
      "severity": "warning",
      "suggestedAction": "人工确认该公开项是否应补充到官方文档。",
      "conflictType": "source-public-item-not-documented"
    },
    {
      "id": "conflict-08b47925ec96ad75",
      "component": "NCCard",
      "itemKind": "slot",
      "itemName": "footer",
      "sourceA": "source-code",
      "sourceB": "official-doc",
      "evidence": [
        {
          "sourceId": "symbol:NCCard",
          "sourceType": "source-code",
          "path": "packages/components/src/card/index.ts",
          "url": null,
          "lineStart": 25,
          "lineEnd": 25,
          "sha256": "sha256:37cd9d9ede0cc520809dc0c85fe76ba5c3e63e8d53a1cd9cbc1de4c56005dd69",
          "commit": "a350b576bbeae6c6254273037a17d2a8730fb80f"
        },
        {
          "sourceId": "ncom-repository-docs",
          "sourceType": "official-doc",
          "path": ".framework-sources/ncom-a350b57/doc/api/components/card.md",
          "url": null,
          "lineStart": null,
          "lineEnd": null,
          "sha256": "sha256:b6f9d4c259290a5a98e96f110029a9e48621e83241e0f9ab049f7c2b729b0ce4",
          "commit": "a350b576bbeae6c6254273037a17d2a8730fb80f"
        }
      ],
      "severity": "warning",
      "suggestedAction": "人工确认该公开项是否应补充到官方文档。",
      "conflictType": "source-public-item-not-documented"
    },
    {
      "id": "conflict-74284b9daf083ce7",
      "component": "NCCard",
      "itemKind": "slot",
      "itemName": "header",
      "sourceA": "source-code",
      "sourceB": "official-doc",
      "evidence": [
        {
          "sourceId": "symbol:NCCard",
          "sourceType": "source-code",
          "path": "packages/components/src/card/index.ts",
          "url": null,
          "lineStart": 25,
          "lineEnd": 25,
          "sha256": "sha256:37cd9d9ede0cc520809dc0c85fe76ba5c3e63e8d53a1cd9cbc1de4c56005dd69",
          "commit": "a350b576bbeae6c6254273037a17d2a8730fb80f"
        },
        {
          "sourceId": "ncom-repository-docs",
          "sourceType": "official-doc",
          "path": ".framework-sources/ncom-a350b57/doc/api/components/card.md",
          "url": null,
          "lineStart": null,
          "lineEnd": null,
          "sha256": "sha256:b6f9d4c259290a5a98e96f110029a9e48621e83241e0f9ab049f7c2b729b0ce4",
          "commit": "a350b576bbeae6c6254273037a17d2a8730fb80f"
        }
      ],
      "severity": "warning",
      "suggestedAction": "人工确认该公开项是否应补充到官方文档。",
      "conflictType": "source-public-item-not-documented"
    },
    {
      "id": "conflict-a798f32999a90891",
      "component": "NCCheckbox",
      "itemKind": "attribute",
      "itemName": "value",
      "sourceA": "official-doc",
      "sourceB": "source-code",
      "evidence": [
        {
          "sourceId": "ncom-repository-docs",
          "sourceType": "official-doc",
          "path": ".framework-sources/ncom-a350b57/doc/api/components/checkbox.md",
          "url": null,
          "lineStart": 16,
          "lineEnd": 16,
          "sha256": "sha256:66ee8885cdda01b4315ef2d7c6e541923730f4218c15b17b15bda79bcf26c85c",
          "commit": "a350b576bbeae6c6254273037a17d2a8730fb80f"
        },
        {
          "sourceId": "symbol:NCCheckbox",
          "sourceType": "source-code",
          "path": "packages/components/src/checkbox/index.ts",
          "url": null,
          "lineStart": 12,
          "lineEnd": 12,
          "sha256": "sha256:982a003822f54de1f742f2180aa64e18ac17d69dd62e528311f0cd1b599b4ef5",
          "commit": "a350b576bbeae6c6254273037a17d2a8730fb80f"
        }
      ],
      "severity": "error",
      "suggestedAction": "人工核对文档项是否仍由组件公开实现。",
      "conflictType": "documented-item-not-found-in-source"
    },
    {
      "id": "conflict-649c9efd7c8b5954",
      "component": "NCCheckbox",
      "itemKind": "attribute",
      "itemName": "disabled",
      "sourceA": "official-doc",
      "sourceB": "source-code",
      "evidence": [
        {
          "sourceId": "ncom-repository-docs",
          "sourceType": "official-doc",
          "path": ".framework-sources/ncom-a350b57/doc/api/components/checkbox.md",
          "url": null,
          "lineStart": 17,
          "lineEnd": 17,
          "sha256": "sha256:66ee8885cdda01b4315ef2d7c6e541923730f4218c15b17b15bda79bcf26c85c",
          "commit": "a350b576bbeae6c6254273037a17d2a8730fb80f"
        },
        {
          "sourceId": "symbol:NCCheckbox",
          "sourceType": "source-code",
          "path": "packages/components/src/checkbox/index.ts",
          "url": null,
          "lineStart": 12,
          "lineEnd": 12,
          "sha256": "sha256:982a003822f54de1f742f2180aa64e18ac17d69dd62e528311f0cd1b599b4ef5",
          "commit": "a350b576bbeae6c6254273037a17d2a8730fb80f"
        }
      ],
      "severity": "error",
      "suggestedAction": "人工核对文档项是否仍由组件公开实现。",
      "conflictType": "documented-item-not-found-in-source"
    },
    {
      "id": "conflict-77f4a14fb5fd383b",
      "component": "NCCheckbox",
      "itemKind": "method",
      "itemName": "value",
      "sourceA": "source-code",
      "sourceB": "official-doc",
      "evidence": [
        {
          "sourceId": "symbol:symbol-43f829569cd5568f",